{
  "version": "2026-07",
  "id": "router_net.schedule",
  "suite": "router_net",
  "tags": [
    "router",
    "realnet"
  ],
  "summary": "真网路由档：schedule_question（需显式 -suite router_net）。",
  "config": {
    "homeTeam": "西班牙",
    "awayTeam": "德国",
    "homePlayers": [
      {
        "number": "10",
        "name": "佩德里",
        "position": "CM"
      },
      {
        "number": "8",
        "name": "法比安",
        "position": "CM"
      },
      {
        "number": "19",
        "name": "亚马尔",
        "position": "RW"
      }
    ],
    "awayPlayers": [
      {
        "number": "10",
        "name": "穆西亚拉",
        "position": "AM"
      }
    ]
  },
  "events": [
    {
      "key": "kickoff",
      "event": {
        "eventType": "kickoff",
        "period": "first_half",
        "clock": "00:30",
        "description": "比赛开始。",
        "visibility": "public"
      }
    },
    {
      "key": "goal",
      "event": {
        "eventType": "goal",
        "period": "first_half",
        "clock": "23:41",
        "teamId": "home",
        "teamName": "西班牙",
        "playerName": "佩德里",
        "score": {
          "home": 1,
          "away": 0
        },
        "intensity": 5,
        "description": "佩德里破门。",
        "visibility": "public",
        "participants": [
          {
            "role": "goal",
            "name": "佩德里",
            "teamId": "home",
            "teamName": "西班牙"
          }
        ]
      }
    }
  ],
  "turns": [
    {
      "id": "ask",
      "userId": "fan-1",
      "text": "西班牙下一场什么时候",
      "expect": {
        "intent": "schedule_question"
      }
    }
  ],
  "final": {
    "minimumTraces": 2
  }
}
