{
  "version": "2026-07",
  "id": "baseline.status-pre-match",
  "suite": "baseline",
  "tags": [
    "status"
  ],
  "summary": "赛前问比分如实报 0-0。",
  "config": {
    "homeTeam": "西班牙",
    "awayTeam": "德国",
    "homePlayers": [
      {
        "number": "10",
        "name": "佩德里",
        "position": "CM"
      },
      {
        "number": "8",
        "name": "法比安",
        "position": "CM"
      },
      {
        "number": "19",
        "name": "亚马尔",
        "position": "RW"
      }
    ],
    "awayPlayers": [
      {
        "number": "10",
        "name": "穆西亚拉",
        "position": "AM"
      }
    ]
  },
  "turns": [
    {
      "id": "pre-score",
      "userId": "fan-1",
      "text": "现在几比几？",
      "expect": {
        "intent": "match_status_question",
        "mustMention": [
          "西班牙",
          "0-0",
          "德国"
        ]
      }
    }
  ],
  "final": {
    "minimumTraces": 1
  }
}
