{
  "version": "2026-07",
  "id": "regression.realizer-provider-fallback",
  "suite": "regression",
  "tags": ["llm", "fallback", "resilience"],
  "summary": "事实回复不调用自由润色层，因此润色提供方超时不能影响比赛事实。",
  "config": {"homeTeam": "西班牙", "awayTeam": "德国"},
  "realizer": {"error": "provider timeout"},
  "events": [
    {
      "key": "goal",
      "event": {
        "eventType": "goal",
        "period": "first_half",
        "clock": "24:10",
        "teamId": "home",
        "teamName": "西班牙",
        "playerName": "佩德里",
        "score": {"home": 1, "away": 0},
        "intensity": 5,
        "description": "佩德里破门。",
        "visibility": "public",
        "participants": [{"role": "assist", "name": "法比安"}, {"role": "pre_assist", "name": "亚马尔"}]
      }
    }
  ],
  "turns": [
    {
      "id": "fallback-assist",
      "userId": "fan-7",
      "text": "刚才谁助攻？",
      "expect": {"intent": "recent_event_question", "mustMention": ["法比安", "亚马尔"], "reason": "deterministic_fact_policy", "requiredTools": ["match.search_events"], "retrievedEventKeys": ["goal"]}
    }
  ],
  "final": {"score": {"home": 1, "away": 0}, "minimumTraces": 1}
}
