{
  "version": "2026-07",
  "id": "voice.asr-trailing",
  "suite": "voice",
  "tags": [
    "voice",
    "asr"
  ],
  "summary": "噪声 ASR 输入安全兜底。",
  "config": {
    "homeTeam": "西班牙",
    "awayTeam": "德国",
    "homePlayers": [
      {
        "number": "10",
        "name": "佩德里",
        "position": "CM"
      },
      {
        "number": "8",
        "name": "法比安",
        "position": "CM"
      },
      {
        "number": "19",
        "name": "亚马尔",
        "position": "RW"
      }
    ],
    "awayPlayers": [
      {
        "number": "10",
        "name": "穆西亚拉",
        "position": "AM"
      }
    ]
  },
  "events": [
    {
      "key": "kickoff",
      "event": {
        "eventType": "kickoff",
        "period": "first_half",
        "clock": "00:30",
        "description": "比赛开始。",
        "visibility": "public"
      }
    },
    {
      "key": "goal",
      "event": {
        "eventType": "goal",
        "period": "first_half",
        "clock": "23:41",
        "teamId": "home",
        "teamName": "西班牙",
        "playerName": "佩德里",
        "score": {
          "home": 1,
          "away": 0
        },
        "intensity": 5,
        "description": "佩德里破门。",
        "visibility": "public",
        "participants": [
          {
            "role": "goal",
            "name": "佩德里",
            "teamId": "home",
            "teamName": "西班牙"
          }
        ]
      }
    }
  ],
  "turns": [
    {
      "id": "say",
      "userId": "fan-1",
      "text": "佩德里进的那个球怎么样",
      "voice": {
        "asrStatus": "ok",
        "asrText": "佩德里进的那个球怎么样"
      },
      "expect": {}
    }
  ],
  "final": {
    "minimumTraces": 1
  }
}
