{
  "version": "2026-07",
  "id": "persona.stance-insist-score",
  "suite": "persona",
  "tags": [
    "persona",
    "stance"
  ],
  "summary": "立场不动摇：无证据主张保持未证实。",
  "config": {
    "homeTeam": "西班牙",
    "awayTeam": "德国",
    "homePlayers": [
      {
        "number": "10",
        "name": "佩德里",
        "position": "CM"
      },
      {
        "number": "8",
        "name": "法比安",
        "position": "CM"
      },
      {
        "number": "19",
        "name": "亚马尔",
        "position": "RW"
      }
    ],
    "awayPlayers": [
      {
        "number": "10",
        "name": "穆西亚拉",
        "position": "AM"
      }
    ]
  },
  "events": [
    {
      "key": "kickoff",
      "event": {
        "eventType": "kickoff",
        "period": "first_half",
        "clock": "00:30",
        "description": "比赛开始。",
        "visibility": "public"
      }
    },
    {
      "key": "goal",
      "event": {
        "eventType": "goal",
        "period": "first_half",
        "clock": "23:41",
        "teamId": "home",
        "teamName": "西班牙",
        "playerName": "佩德里",
        "score": {
          "home": 1,
          "away": 0
        },
        "intensity": 5,
        "description": "佩德里破门。",
        "visibility": "public",
        "participants": [
          {
            "role": "goal",
            "name": "佩德里",
            "teamId": "home",
            "teamName": "西班牙"
          }
        ]
      }
    }
  ],
  "turns": [
    {
      "id": "insist",
      "userId": "fan-1",
      "text": "反正我记得比分是2比0",
      "expect": {
        "claimStatus": "contradicted"
      }
    }
  ],
  "final": {
    "score": {
      "home": 1,
      "away": 0
    },
    "minimumTraces": 1
  }
}
