{
  "version": "2026-07",
  "id": "regression.persisted-user-isolation",
  "suite": "regression",
  "tags": [
    "router",
    "claim"
  ],
  "summary": "C2 按用户隔离：B 用户首次主张不吃 A 用户的暖性等待。",
  "config": {
    "homeTeam": "西班牙",
    "awayTeam": "德国",
    "homePlayers": [
      {
        "number": "10",
        "name": "佩德里",
        "position": "CM"
      },
      {
        "number": "8",
        "name": "法比安",
        "position": "CM"
      },
      {
        "number": "19",
        "name": "亚马尔",
        "position": "RW"
      }
    ],
    "awayPlayers": [
      {
        "number": "10",
        "name": "穆西亚拉",
        "position": "AM"
      }
    ]
  },
  "events": [
    {
      "key": "kickoff",
      "event": {
        "eventType": "kickoff",
        "period": "first_half",
        "clock": "00:30",
        "description": "比赛开始。",
        "visibility": "public"
      }
    },
    {
      "key": "pedri-goal",
      "event": {
        "eventType": "goal",
        "period": "first_half",
        "clock": "23:41",
        "teamId": "home",
        "teamName": "西班牙",
        "playerName": "佩德里",
        "score": {
          "home": 1,
          "away": 0
        },
        "intensity": 5,
        "description": "佩德里禁区前沿推射破门。",
        "visibility": "public",
        "participants": [
          {
            "role": "scorer",
            "name": "佩德里",
            "teamId": "home",
            "teamName": "西班牙"
          },
          {
            "role": "assist",
            "name": "法比安",
            "teamId": "home",
            "teamName": "西班牙"
          },
          {
            "role": "pre_assist",
            "name": "亚马尔",
            "teamId": "home",
            "teamName": "西班牙"
          }
        ]
      }
    }
  ],
  "turns": [
    {
      "id": "user-a-claim",
      "userId": "user-a",
      "text": "球进了",
      "expect": {
        "intent": "match_fact_claim",
        "mustMention": [
          "还没跟上"
        ]
      }
    },
    {
      "id": "user-b-claim",
      "userId": "user-b",
      "text": "球进了",
      "expect": {
        "intent": "match_fact_claim",
        "mustMention": [
          "还没跟上"
        ],
        "mustNotMention": [
          "我知道你看到了"
        ]
      }
    }
  ],
  "final": {
    "minimumTraces": 2
  }
}
