{
  "version": "2026-07",
  "id": "companion.manual-proactive-line",
  "suite": "companion",
  "tags": [
    "companion",
    "operator"
  ],
  "summary": "运营人工话术优先于罐头。",
  "config": {
    "homeTeam": "西班牙",
    "awayTeam": "德国",
    "homePlayers": [
      {
        "number": "10",
        "name": "佩德里",
        "position": "CM"
      },
      {
        "number": "8",
        "name": "法比安",
        "position": "CM"
      },
      {
        "number": "19",
        "name": "亚马尔",
        "position": "RW"
      }
    ],
    "awayPlayers": [
      {
        "number": "10",
        "name": "穆西亚拉",
        "position": "AM"
      }
    ]
  },
  "events": [
    {
      "key": "kickoff",
      "event": {
        "eventType": "kickoff",
        "period": "first_half",
        "clock": "00:30",
        "description": "比赛开始。",
        "visibility": "public"
      }
    },
    {
      "key": "manual",
      "event": {
        "eventType": "goal",
        "period": "first_half",
        "clock": "40:00",
        "teamId": "home",
        "teamName": "西班牙",
        "playerName": "亚马尔",
        "score": {
          "home": 1,
          "away": 0
        },
        "intensity": 5,
        "description": "亚马尔远射得分。",
        "visibility": "public",
        "participants": [
          {
            "role": "goal",
            "name": "亚马尔",
            "teamId": "home",
            "teamName": "西班牙"
          }
        ]
      }
    }
  ]
}
